{
  "$schema": "https://json-schema.org/draft/2020-12/schema",
  "$id": "https://tutor-guardian.local/schemas/curriculum/daily_tip.schema.json",
  "title": "Daily Tip",
  "description": "نصيحة يومية قصيرة (≤ 280 حرف) مستخرجة من knowledge unit واحد. تظهر في الواجهة الرئيسية للـ app. لا تتبع مساراً معيناً — تُختار من pool حسب age_group + يوم الأسبوع (rotating). ملاحظة: enum تطابق backend/app/core/taxonomy.py.",
  "type": "object",
  "additionalProperties": false,
  "required": [
    "id",
    "age_group",
    "domain",
    "text",
    "unit_id"
  ],
  "properties": {
    "id": {
      "type": "string",
      "pattern": "^tip_[a-z0-9_-]+_[0-9]{3,4}$",
      "description": "معرّف النصيحة. النمط: tip_<age_group>_<seq>. مثال: tip_4-6_001. الـ seq يتجدد لكل age_group."
    },
    "age_group": {
      "type": "string",
      "enum": [
        "0-3",
        "10-12",
        "13-15",
        "16-18",
        "2-3",
        "4-6",
        "7-9",
        "prenatal-1",
        "unspecified"
      ],
      "description": "الفئة العمرية. النصيحة تُفلتر على الواجهة بناءً على child profile."
    },
    "domain": {
      "type": "string",
      "enum": [
        "aqeedah",
        "cyber",
        "development",
        "islamic_parenting",
        "medical",
        "infant_pregnancy"
      ],
      "description": "المجال. يؤثر على badge/icon النصيحة في الـ UI."
    },
    "text": {
      "type": "string",
      "minLength": 20,
      "maxLength": 280,
      "description": "النصيحة المختصرة. جملة أو جملتان. مثال: 'قبل النوم: اقرأ لطفلك آية الكرسي واشرح له أنها حماية'."
    },
    "unit_id": {
      "type": [
        "string",
        "null"
      ],
      "format": "uuid",
      "description": "معرّف knowledge unit الأصلي (من knowledge_base/units/*.json). النصيحة مختصرة من unit.text_simplified."
    },
    "day_of_week": {
      "type": "integer",
      "minimum": 0,
      "maximum": 6,
      "description": "يوم الأسبوع المفضّل (0=الإثنين، 6=الأحد). اختياري. لو غير محدد تظهر في أي يوم (rotating)."
    },
    "time_of_day": {
      "type": "string",
      "enum": [
        "morning",
        "evening",
        "bedtime",
        "anytime"
      ],
      "default": "anytime",
      "description": "الوقت الإرشادي للعرض في الواجهة."
    },
    "tags": {
      "type": "array",
      "maxItems": 5,
      "items": {
        "type": "string"
      },
      "default": [],
      "description": "وسوم للبحث/الفلترة (مثل: 'صلاة', 'نوم', 'أكل')."
    },
    "is_published": {
      "type": "boolean",
      "default": true,
      "description": "النصائح في الـ pool تكون true افتراضياً (للتنويع في العرض)."
    },
    "version": {
      "type": "string",
      "pattern": "^\\d+\\.\\d+\\.\\d+$"
    },
    "created_at": {
      "type": "string",
      "format": "date-time"
    },
    "approved_by": {
      "type": [
        "string",
        "null"
      ],
      "description": "من أجاز هذا المحتوى. في ملفات i18n/en: إما اسم مراجِع بشري، وإما ختم المراجعة الآلية `auto-review:<مراجع A>+<مراجع B>:<YYYY-MM-DD>` الذي يكتبه ops/tools/review_en_parity.py بعد أن تمرّ الحرّاس الحتمية ولا يجد مراجعان من عائلتَي نماذج مختلفتين عيبًا متوسطًا أو عاليًا في النص بعينه (بصمته في translation.auto_review.content_sha256). الختم الآلي ليس إجازة شرعية ولا يدّعيها. null = لم يجتز البوابة، لا يُنشر للإنجليزية (يرفضه pre-commit).",
      "default": null
    },
    "language": {
      "type": "string",
      "description": "لغة هذا الملف. غيابه = العربية (لغة المصدر). الترجمات في i18n/<lang>/."
    },
    "source_language": {
      "type": "string",
      "description": "اللغة التي تُرجم عنها هذا الملف. للمصدر العربي: غير موجود."
    },
    "translation": {
      "type": "object",
      "description": "سجل الترجمة والمراجعة. تكتبه ops/tools/translate_curriculum.py، ويختمه ops/tools/review_en_parity.py (approved_by + auto_review) بعد المراجعة الآلية المزدوجة.",
      "properties": {
        "translator_model": {
          "type": [
            "string",
            "null"
          ]
        },
        "reviewer_model": {
          "type": [
            "string",
            "null"
          ]
        },
        "needs_scholar_review": {
          "type": "boolean"
        },
        "scholar_signals": {
          "type": "object"
        },
        "review_verdict": {
          "type": "string",
          "enum": [
            "clean",
            "defects",
            "pending",
            "unreviewed"
          ]
        },
        "review_defects": {
          "type": "array",
          "items": {
            "type": "object"
          }
        },
        "revalidated_at": {
          "type": "string",
          "description": "متى أُعيد الحكم على النص الحالي. غيابه = السجل قد يصف نصًّا أُصلح بعده."
        },
        "approved_by": {
          "type": [
            "string",
            "null"
          ],
          "description": "نفس قيمة approved_by في الجذر: اسم مراجِع بشري أو ختم auto-review:<A>+<B>:<date>. null = غير مراجَع."
        }
      },
      "additionalProperties": true
    }
  }
}
