{
  "id": "tip_7-9_002",
  "age_group": "7-9",
  "domain": "islamic_parenting",
  "text": "إذا أظهر طفلك مللًا من الصلاة، لا توبخه. اسأله: \"ما الذي يجعلها صعبة عليك؟\" — الاستماع بداية الحل.",
  "unit_id": "8e884b98-41a4-4c29-92c5-aa71e62d7d51",
  "day_of_week": 1,
  "time_of_day": "evening",
  "approved_by": null
}
