{
  "id": "tip_7-9_003",
  "age_group": "7-9",
  "domain": "islamic_parenting",
  "text": "Your child fidgets during Salah? This is normal for his age. Pray in front of him, let him count the rak‘āt, and praise him for every improvement.",
  "unit_id": "b1bd26fc-3144-4928-9bb4-ce2b30f95876",
  "day_of_week": 2,
  "time_of_day": "morning",
  "approved_by": "auto-review:deepseek-v4-pro+glm-5.2:2026-10-04",
  "language": "en",
  "source_language": "ar",
  "translation": {
    "translator_model": "mistral-large-3:675b",
    "reviewer_model": "deepseek-v4-pro+glm-5.2",
    "needs_scholar_review": true,
    "scholar_signals": {
      "keyword": false,
      "quoted_arabic": true,
      "reviewer_model": false
    },
    "review_verdict": "clean",
    "review_defects": [],
    "approved_by": "auto-review:deepseek-v4-pro+glm-5.2:2026-10-04",
    "revalidated_at": "2026-10-04T11:18:18+00:00",
    "auto_review": {
      "reviewers": [
        "deepseek-v4-pro",
        "glm-5.2"
      ],
      "fixer": null,
      "rounds": 1,
      "prompt_version": "dfa8a5f39718",
      "content_sha256": "54e49a6890036a2ce76575fe4fe564d3ecc1b4d04a7b816f329e39de074eb00d",
      "reviewed_at": "2026-10-04T11:18:18+00:00",
      "residual_low": [],
      "adjudicated": [],
      "tool": "ops/tools/review_en_parity.py",
      "meaning": "deterministic guards passed and two different-family model reviewers found no medium/high defect in this exact text; not a scholar's ijazah"
    }
  }
}
