{
  "id": "tip_2-3_030",
  "age_group": "2-3",
  "domain": "development",
  "text": "شجّعي فضول طفلك: خذيه إلى الحديقة أو في نزهة قصيرة، ودعيه يلاحظ الأشجار والأصوات والألوان، واستمعي إلى ما يشير إليه أو يقوله.",
  "unit_id": null,
  "day_of_week": 3,
  "time_of_day": "evening",
  "tags": [],
  "is_published": true,
  "version": "1.0.0",
  "created_at": "2026-06-19T12:00:00",
  "approved_by": null
}
