{
  "id": "tip_10-12_028",
  "age_group": "10-12",
  "domain": "medical",
  "text": "Less sugar, more movement, better sleep — habits that may support your child’s mood and concentration over time, though children respond differently. If difficulties persist, consult a professional.",
  "unit_id": "med-af2d64fa",
  "day_of_week": 2,
  "time_of_day": "evening",
  "approved_by": null,
  "language": "en",
  "source_language": "ar",
  "translation": {
    "translator_model": "mistral-large-3:675b",
    "reviewer_model": "deepseek-v4-pro+glm-5.2",
    "needs_scholar_review": true,
    "scholar_signals": {
      "keyword": false,
      "quoted_arabic": true,
      "reviewer_model": false
    },
    "review_verdict": "pending",
    "review_defects": [],
    "approved_by": null,
    "revalidated_at": "2026-10-04T11:18:18+00:00"
  }
}
