{
  "id": "tip_16-18_030",
  "age_group": "16-18",
  "domain": "medical",
  "text": "ابنك يقترب من الاستقلال، فشجّعه على عادات تحمي صحته النفسية: نوم منتظم، وحركة، وصحبة طيبة، وعبادة يجد فيها السكينة. وذكّره أن العناية بنفسه اليوم استثمار في مستقبله.",
  "unit_id": "e5d132da-cdb4-403a-a43e-e78640ee6270",
  "day_of_week": 4,
  "time_of_day": "evening",
  "approved_by": null
}
