{
  "id": "tip_7-9_014",
  "age_group": "7-9",
  "domain": "medical",
  "text": "صندوق الهدوء: ورقة، وأقلام، وكرة ضغط، وصور مهدئة. عندما يغضب طفلك، اذهبا إلى الصندوق معاً، ودعه يختار أداة، ثم تحدثا حين يهدأ ويكون مستعداً.",
  "unit_id": "78431bb2-354f-43ef-a874-d17bc11ed6e6",
  "day_of_week": 4,
  "time_of_day": "evening",
  "approved_by": null
}
