{
  "id": "tip_2-3_029",
  "age_group": "2-3",
  "domain": "islamic_parenting",
  "text": "Let your child see you praying; your quiet example is more powerful than a thousand commands.",
  "unit_id": null,
  "day_of_week": 2,
  "time_of_day": "anytime",
  "tags": [],
  "is_published": true,
  "version": "1.0.0",
  "created_at": "2026-06-19T12:00:00",
  "approved_by": "auto-review:deepseek-v4-pro+glm-5.2:2026-10-08",
  "language": "en",
  "source_language": "ar",
  "translation": {
    "translator_model": "mistral-large-3:675b",
    "reviewer_model": "deepseek-v4-pro+glm-5.2",
    "needs_scholar_review": true,
    "scholar_signals": {
      "keyword": false,
      "quoted_arabic": true,
      "reviewer_model": false
    },
    "review_verdict": "clean",
    "review_defects": [],
    "approved_by": "auto-review:deepseek-v4-pro+glm-5.2:2026-10-08",
    "revalidated_at": "2026-10-08T18:17:08+00:00",
    "auto_review": {
      "reviewers": [
        "deepseek-v4-pro",
        "glm-5.2"
      ],
      "providers": {
        "deepseek-v4-pro": {
          "provider": "openrouter",
          "model": "deepseek/deepseek-v4-pro"
        },
        "glm-5.2": {
          "provider": "openrouter",
          "model": "z-ai/glm-5.2"
        }
      },
      "fixer": null,
      "rounds": 1,
      "prompt_version": "dfa8a5f39718",
      "content_sha256": "804392be71b54ad38882e425e66837fd1bcfba9607d58c79637dfc2ff8635c54",
      "reviewed_at": "2026-10-08T18:17:08+00:00",
      "residual_low": [],
      "adjudicated": [],
      "tool": "ops/tools/review_en_parity.py",
      "meaning": "deterministic guards passed and two different-family model reviewers found no medium/high defect in this exact text; certifies that the English matches the Arabic, not that the Arabic is faithful to its own source; not a scholar's ijazah"
    }
  }
}
