{
  "id": "tip_4-6_018",
  "age_group": "4-6",
  "domain": "medical",
  "text": "When you find it hard to understand your child’s behaviour: remember that both hereditary and environmental factors play a role. It is not a failure in tarbiyah (upbringing), nor a flaw in the child.",
  "unit_id": "f37ace62-b2eb-4cc0-8eb5-c34484407199",
  "day_of_week": 3,
  "time_of_day": "anytime",
  "tags": [
    "صحة_نفسية",
    "تفهم",
    "مودة"
  ],
  "is_published": true,
  "version": "1.0.0",
  "created_at": "2026-06-08T19:00:00",
  "approved_by": "auto-review:deepseek-v4-pro+glm-5.2:2026-10-04",
  "language": "en",
  "source_language": "ar",
  "translation": {
    "translator_model": "mistral-large-3:675b",
    "reviewer_model": "deepseek-v4-pro+glm-5.2",
    "needs_scholar_review": true,
    "scholar_signals": {
      "keyword": false,
      "quoted_arabic": true,
      "reviewer_model": false
    },
    "review_verdict": "clean",
    "review_defects": [],
    "approved_by": "auto-review:deepseek-v4-pro+glm-5.2:2026-10-04",
    "revalidated_at": "2026-10-04T11:18:18+00:00",
    "auto_review": {
      "reviewers": [
        "deepseek-v4-pro",
        "glm-5.2"
      ],
      "fixer": null,
      "rounds": 1,
      "prompt_version": "dfa8a5f39718",
      "content_sha256": "88e20a2db31a82b6a7108f86e6e45023f0558390f8718dde48ebad5846d0d968",
      "reviewed_at": "2026-10-04T11:18:18+00:00",
      "residual_low": [],
      "adjudicated": [],
      "tool": "ops/tools/review_en_parity.py",
      "meaning": "deterministic guards passed and two different-family model reviewers found no medium/high defect in this exact text; not a scholar's ijazah"
    }
  }
}
