{
  "id": "tip_prenatal-1_001",
  "age_group": "prenatal-1",
  "domain": "infant_pregnancy",
  "text": "للحامل: يتكوّن سمع الجنين في منتصف الحمل تقريباً، ويصله صوتك خافتاً عبر الرحم. تلاوتك للقرآن وحديثك معه بهدوء وقتٌ طيب لكِ ولصلتك به، دون أن نجزم بأثر محدد في نفسه قبل الولادة.",
  "unit_id": null,
  "day_of_week": 0,
  "time_of_day": "morning",
  "tags": [
    "حمل",
    "سماع_الجنين",
    "قرآن"
  ],
  "is_published": true,
  "version": "1.0.0",
  "created_at": "2026-09-12T19:00:00",
  "approved_by": null
}
