{
  "id": "tip_13-15_013",
  "age_group": "13-15",
  "domain": "cyber",
  "text": "التزييف العميق (Deepfake) والذكاء الاصطناعي يصنعون مزيفاً لا يُميَّز. القاعدة: مصدر؟ تأكيد مستقل؟ يثير خوفاً/غضباً؟",
  "unit_id": "e3caaf25-9c84-4ff2-a924-00263347df1c",
  "day_of_week": 2,
  "time_of_day": "evening",
  "approved_by": null
}
