{
  "id": "tip_0-3_003",
  "age_group": "0-3",
  "domain": "medical",
  "text": "Read to your child for five minutes every day from birth — even if they do not understand the words. Your voice, the rhythm of the language, and the images build the brain pathways for future reading. No screens before the age of two.",
  "unit_id": "med-1eb2b059",
  "day_of_week": 2,
  "time_of_day": "evening",
  "tags": [
    "قراءة",
    "لغة",
    "دماغ",
    "صفر شاشات"
  ],
  "is_published": true,
  "version": "1.0.0",
  "created_at": "2026-06-10T14:00:00",
  "approved_by": "auto-review:deepseek-v4-pro+glm-5.2:2026-10-04",
  "language": "en",
  "source_language": "ar",
  "translation": {
    "translator_model": "mistral-large-3:675b",
    "reviewer_model": "deepseek-v4-pro+glm-5.2",
    "needs_scholar_review": true,
    "scholar_signals": {
      "keyword": false,
      "quoted_arabic": true,
      "reviewer_model": false
    },
    "review_verdict": "clean",
    "review_defects": [],
    "approved_by": "auto-review:deepseek-v4-pro+glm-5.2:2026-10-04",
    "revalidated_at": "2026-10-04T11:18:18+00:00",
    "auto_review": {
      "reviewers": [
        "deepseek-v4-pro",
        "glm-5.2"
      ],
      "fixer": null,
      "rounds": 1,
      "prompt_version": "dfa8a5f39718",
      "content_sha256": "55438b31ccaa673effadfafedf4ac1d8fb55d6ae28f8451f743bfe3c1799474a",
      "reviewed_at": "2026-10-04T11:18:18+00:00",
      "residual_low": [],
      "adjudicated": [],
      "tool": "ops/tools/review_en_parity.py",
      "meaning": "deterministic guards passed and two different-family model reviewers found no medium/high defect in this exact text; not a scholar's ijazah"
    }
  }
}
