{
  "id": "tip_16-18_006",
  "age_group": "16-18",
  "domain": "medical",
  "text": "إذا تحدث ابنك عن الانتحار أو عن خطة أو وسيلة لإيذاء نفسه، فهذه حالة طوارئ: لا تتركه وحده، وأبعد عنه أي وسيلة خطرة، واتصل فورًا برقم الطوارئ في بلدك أو اذهب به إلى أقرب قسم طوارئ.",
  "unit_id": "e19e72c2-d553-4e12-a6e6-5d7c6f3fc083",
  "day_of_week": 2,
  "time_of_day": "evening",
  "approved_by": null
}
