{
  "id": "tip_13-15_026",
  "age_group": "13-15",
  "domain": "medical",
  "text": "Aptitude tests (planning, decision-making, visual skills) help in understanding the adolescent’s brain and supporting the adolescent.",
  "unit_id": "med-e64897f2",
  "day_of_week": 4,
  "time_of_day": "morning",
  "approved_by": "auto-review:deepseek-v4-pro+glm-5.2:2026-10-04",
  "language": "en",
  "source_language": "ar",
  "translation": {
    "translator_model": "mistral-large-3:675b",
    "reviewer_model": "deepseek-v4-pro+glm-5.2",
    "needs_scholar_review": true,
    "scholar_signals": {
      "keyword": false,
      "quoted_arabic": true,
      "reviewer_model": false
    },
    "review_verdict": "clean",
    "review_defects": [],
    "approved_by": "auto-review:deepseek-v4-pro+glm-5.2:2026-10-04",
    "revalidated_at": "2026-10-04T11:18:18+00:00",
    "fixed_at": "2026-08-13T18:53:00.221446+00:00",
    "fixer_model": "mistral-large-3:675b",
    "auto_review": {
      "reviewers": [
        "deepseek-v4-pro",
        "glm-5.2"
      ],
      "fixer": null,
      "rounds": 1,
      "prompt_version": "dfa8a5f39718",
      "content_sha256": "eaa5a33a793eb430f041dc6c90b6a589d0927a46e16098e73af20495fb2c2a07",
      "reviewed_at": "2026-10-04T11:18:18+00:00",
      "residual_low": [],
      "adjudicated": [],
      "tool": "ops/tools/review_en_parity.py",
      "meaning": "deterministic guards passed and two different-family model reviewers found no medium/high defect in this exact text; not a scholar's ijazah"
    }
  }
}
