{
  "id": "tip_0-3_002",
  "age_group": "0-3",
  "domain": "medical",
  "text": "ضع رضيعك على ظهره في كل نوم، قيلولةً وليلاً، على سطح ثابت مستوٍ بملاءة مثبتة فقط. لا وسائد ولا بطانيات أو أغطية فضفاضة ولا ألعاب أو مصدّات في سريره. ويُنصح أن ينام في غرفتك بسرير مستقل في الأشهر الستة الأولى على الأقل.",
  "unit_id": "med-2dc3af5f",
  "day_of_week": 1,
  "time_of_day": "bedtime",
  "tags": [
    "نوم آمن",
    "SIDS",
    "ظهر"
  ],
  "is_published": true,
  "version": "1.0.0",
  "created_at": "2026-06-10T14:00:00",
  "approved_by": null
}
