{
  "id": "tip_4-6_021",
  "age_group": "4-6",
  "domain": "development",
  "text": "هذا الأسبوع: كل صباح، خصص 5 دقائق 'جولة أمان' في البيت. انزل إلى مستوى نظر طفلك. ابحث عن مخاطر الحوادث — سلالم، مقابس كهربائية، أشياء حادة.",
  "unit_id": "dev-b3e9a4e0",
  "day_of_week": 4,
  "time_of_day": "anytime",
  "tags": [
    "أمان",
    "حوادث",
    "وقاية"
  ],
  "is_published": true,
  "version": "1.0.0",
  "created_at": "2026-06-08T19:00:00",
  "approved_by": null
}
