{
  "id": "tip_2-3_001",
  "age_group": "2-3",
  "domain": "development",
  "text": "Teach him istinja’ (cleansing after relieving oneself) and its importance, and train him to enter the bathroom with the left foot and exit with the right. Make him memorize the du’a for entering and exiting to embed these adab (manners) as part of his routine.",
  "unit_id": null,
  "day_of_week": 1,
  "time_of_day": "anytime",
  "tags": [],
  "is_published": true,
  "version": "1.0.0",
  "created_at": "2026-06-13T10:00:00",
  "approved_by": "auto-review:deepseek-v4-pro+glm-5.2:2026-10-04",
  "language": "en",
  "source_language": "ar",
  "translation": {
    "translator_model": "mistral-large-3:675b",
    "reviewer_model": "deepseek-v4-pro+glm-5.2",
    "needs_scholar_review": true,
    "scholar_signals": {
      "keyword": false,
      "quoted_arabic": true,
      "reviewer_model": false
    },
    "review_verdict": "clean",
    "review_defects": [],
    "approved_by": "auto-review:deepseek-v4-pro+glm-5.2:2026-10-04",
    "revalidated_at": "2026-10-04T11:18:18+00:00",
    "fixed_at": "2026-08-13T17:59:39.828538+00:00",
    "fixer_model": "mistral-large-3:675b",
    "auto_review": {
      "reviewers": [
        "deepseek-v4-pro",
        "glm-5.2"
      ],
      "fixer": null,
      "rounds": 1,
      "prompt_version": "dfa8a5f39718",
      "content_sha256": "d4501bd3f1709dce96aea0ec9f70034b92a65a34d6df944075a9257e1bb6bc45",
      "reviewed_at": "2026-10-04T11:18:18+00:00",
      "residual_low": [],
      "adjudicated": [],
      "tool": "ops/tools/review_en_parity.py",
      "meaning": "deterministic guards passed and two different-family model reviewers found no medium/high defect in this exact text; not a scholar's ijazah"
    }
  }
}
