{
  "id": "tip_13-15_024",
  "age_group": "13-15",
  "domain": "medical",
  "text": "Cognitive behavioural therapy (CBT) can help with anxiety. For ADHD, a specialist sets a plan that suits your teen, which may include support at home and school and medicine. Look for a professional who specialises in adolescents.",
  "unit_id": "med-c974d9d8",
  "day_of_week": 3,
  "time_of_day": "morning",
  "approved_by": null,
  "language": "en",
  "source_language": "ar",
  "translation": {
    "translator_model": "mistral-large-3:675b",
    "reviewer_model": "deepseek-v4-pro+glm-5.2",
    "needs_scholar_review": true,
    "scholar_signals": {
      "keyword": false,
      "quoted_arabic": true,
      "reviewer_model": false
    },
    "review_verdict": "pending",
    "review_defects": [
      {
        "model": "glm-5.2",
        "field": "text",
        "type": "addition",
        "why": "The English inserts the abbreviation (CBT) not present in the Arabic, though it is a standard gloss of the same term."
      }
    ],
    "approved_by": null,
    "revalidated_at": "2026-10-04T17:02:06+00:00"
  }
}
