{
  "id": "tip_7-9_029",
  "age_group": "7-9",
  "domain": "medical",
  "text": "راقب العادات بهدوء، ودوّن متى تظهر دون أن تحرج طفلك. وإن رغب في تركها فاتفقا على تذكير لطيف بينكما، وشارك ملاحظاتك مع الطبيب إن سببت ألماً أو أذى.",
  "unit_id": "med-6fd9c009",
  "day_of_week": 5,
  "time_of_day": "evening",
  "approved_by": null
}
