{
  "id": "tip_0-3_016",
  "age_group": "0-3",
  "domain": "development",
  "text": "طفلك يتعلم بالحركة: الزحف والمشي والتسلق والرمي تساعده على فهم المكان من حوله. وفّر له يومياً مساحة آمنة للحركة الحرة بما يناسب قدراته، واسأل طبيبه إن أقلقتك حركته. وسرعة المشي أو الزحف ليست مقياساً لذكائه.",
  "unit_id": "dev-8fdf563b",
  "day_of_week": 3,
  "time_of_day": "morning",
  "tags": [
    "حركة",
    "زحف",
    "دماغ",
    "حس_حركي"
  ],
  "is_published": true,
  "version": "1.0.0",
  "created_at": "2026-06-10T20:00:00",
  "approved_by": null
}
