{
  "id": "tip_16-18_008",
  "age_group": "16-18",
  "domain": "medical",
  "text": "اصنع مع ابنك، وبمساعدة مختص إن أمكن، بطاقة سلامة فيها: علامات تحذير يعرفها في نفسه، وطرق للتهدئة، وأشخاص يثق بهم، ورقم المختص والطوارئ في بلدكم، وخطوات لإبعاد الوسائل الخطرة. احفظاها في هاتفيكما، وهي لا تغني عن الطوارئ عند الخطر الوشيك.",
  "unit_id": "83f8a5c4-defa-49a6-91ec-8504fee1140e",
  "day_of_week": 3,
  "time_of_day": "morning",
  "approved_by": null
}
