{
  "id": "tip_4-6_012",
  "age_group": "4-6",
  "domain": "development",
  "text": "هذا المساء: ضع لطفلك هدفاً واحداً صغيراً للغد ('ضع حذاءك في مكانه قبل النوم'). الهدف الصغير الواحد أنجح من قائمة طويلة.",
  "unit_id": "dev-ad9ff74a",
  "day_of_week": 2,
  "time_of_day": "evening",
  "tags": [
    "أهداف",
    "تخطيط",
    "مسؤولية"
  ],
  "is_published": true,
  "version": "1.0.0",
  "created_at": "2026-06-08T19:00:00",
  "approved_by": null
}
